{
  "$schema": "https://json-schema.org/draft/2020-12/schema",
  "$id": "https://signal.dev/schemas/signal-envelope.schema.json",
  "title": "Signal Envelope",
  "type": "object",
  "required": ["protocol", "kind", "name", "messageId", "timestamp", "payload"],
  "properties": {
    "protocol": {
      "const": "signal.v1"
    },
    "kind": {
      "enum": ["query", "mutation", "event"]
    },
    "name": {
      "type": "string",
      "pattern": "^[a-z][a-z0-9]*(\\.[a-z][a-z0-9]*)*\\.[a-z][a-z0-9-]*\\.v[1-9][0-9]*$"
    },
    "messageId": {
      "type": "string",
      "minLength": 1
    },
    "timestamp": {
      "type": "string",
      "format": "date-time"
    },
    "source": {
      "type": "object",
      "additionalProperties": true
    },
    "context": {
      "type": "object",
      "additionalProperties": true
    },
    "delivery": {
      "type": "object",
      "additionalProperties": true
    },
    "auth": {
      "type": "object",
      "properties": {
        "actor": {
          "type": "object",
          "additionalProperties": true
        },
        "subject": {
          "type": "string"
        },
        "scopes": {
          "type": "array",
          "items": {
            "type": "string"
          }
        }
      },
      "additionalProperties": true
    },
    "payload": {},
    "meta": {
      "type": "object",
      "additionalProperties": true
    }
  },
  "additionalProperties": true
}
